{"acceptance":{"contractDigest":"2372c4a56021de3b3d4e0bd6ceaf22c301da075d92e3811c9b942497d4bc2d1f","contractRef":"sha256:2372c4a56021de3b3d4e0bd6ceaf22c301da075d92e3811c9b942497d4bc2d1f","evidenceDigest":"5f7eaeb94bb169f689d4a072cd2c4f3636a907ecf14fa408e7e6c500b7a9486a","evidenceRef":"sha256:5f7eaeb94bb169f689d4a072cd2c4f3636a907ecf14fa408e7e6c500b7a9486a","validator":"agenttalk.acceptance.validator.v1","validatorVersion":"1"},"allowedConsumers":[{"agentId":"agent-developer","roleId":"developer","taskNodeId":"node-developer"}],"artifactBindings":[{"artifactRef":{"contentSchemaRef":{"digest":"0315fc123cf5b3495e854ac63c47aaff76b34851a87baa07a783533f93acfe57","id":"agenttalk.design.spec.v1","version":"1"},"normalizedContentType":"text/markdown","normalizedContentTypePolicyVersion":"1","objectRef":"sha256:f83bbd7ac5410073378b673b75bff4b796a8e3ccab650d15d59668af2d521c1e","sha256":"f83bbd7ac5410073378b673b75bff4b796a8e3ccab650d15d59668af2d521c1e","size":44},"sourceOutput":{"portId":"alpha"},"targetInput":{"portId":"alpha-in"}},{"artifactRef":{"contentSchemaRef":{"digest":"0315fc123cf5b3495e854ac63c47aaff76b34851a87baa07a783533f93acfe57","id":"agenttalk.notes.v1","version":"1"},"normalizedContentType":"text/plain","normalizedContentTypePolicyVersion":"1","objectRef":"sha256:c6737b8221293b21d06c100c5eedb58ae4b30847b01888cccab22d50bb578025","sha256":"c6737b8221293b21d06c100c5eedb58ae4b30847b01888cccab22d50bb578025","size":27},"sourceOutput":{"portId":"zeta"},"targetInput":{"portId":"zeta-in"}}],"artifactTransferSetDigest":"72b860950d63852c3c65d75401cf22e363325ffba85bdc71559f55735156733c","dagSnapshotDigest":"1111111111111111111111111111111111111111111111111111111111111111","declarationDigest":"0286f580615d4a573754279f904aab6443a7c26d0d00dcb2b4346712603de563","deliveryPayloadDigest":"ae77a7a4f22639ba01a69f3625f60fa4e11c9d28da3bf423dace0fffa1eba1c3","edgeId":"edge-0001","envelopeSha256":"23daffb83368e04bbcf7b61300b70cbc91d7fa7647ad677b61ca7b940cc8efa4","from":{"attemptId":"1","executionRunId":"er-0001","taskNodeId":"node-architect"},"handoffId":"handoff-0001","idempotencyKey":"0dece97dfdf769c592529c2f5984a791769e98aaa96c85396deafe597dc299b9","leaseEpoch":3,"ownerBinding":{"roleId":"architect","taskNodeId":"node-architect"},"producer":{"agentId":"agent-architect","roleId":"architect"},"producerContextManifestDigest":"3333333333333333333333333333333333333333333333333333333333333333","projectRunId":"run-0001","roleBindingSnapshotDigest":"2222222222222222222222222222222222222222222222222222222222222222","schemaVersion":"agenttalk.handoff.envelope.v1","to":{"agentId":"agent-developer","roleId":"developer","taskNodeId":"node-developer"}}